{"schema_version":1,"id":"lvl_remix_sam","game_id":"game_starter","parent_id":"lvl_remix_maya","order_index":0,"title":"First Steps speedrun","author":"sam","created_at":"2026-10-09T02:00:00Z","source":{"kind":"fixture","photo_url":null,"backdrop_url":"/uploads/lvl_remix_sam/backdrop.png","template_version":1},"grid":{"w":48,"h":27,"cell":16,"rows":["000000000000000000000000000000000000000000000000","000000000000000000000000000000000000000000000000","000000000000000000000000000000000000000000000000","000000000000000000000000000000000000000000000000","000000000000000000000000000000000000000000000000","000000000000000000000000000000000000000000000000","000000000000000000000000000000000000000000000000","000000000000000000000000000000000000000000000000","000000000000000000000000000000000000000000000000","000000000000000000000000000000000000000000000000","000000000000000000000000000000000000000000000000","000000000000000000000000000000000000000000000000","000000000000000000000000000000000000000000000000","000000000000000000000000000000000000000000000000","000000000000000000000000000000000000000000000000","000000000000000000000000000000000000000000000000","000000000000000000000000000000000000000000000000","000000000000000000000000000000000000000000000000","000000000000000000000000000000000000000000000000","000000000000000000000000000000000000000000000000","000000000000000000000000000000000000000000000000","000000000000000000000000000000000000000000000000","000000000000000000111100000000000011111000000000","000000000000001111111111110000000000000000000000","000000000011111111111111111111000000000000000000","111112221111111111111111111111111111111111111111","111111111111111111111111111111111111111111111111"]},"sprites":{"player":null},"components":[],"entities":[{"id":"start","type":"player_start","x":2,"y":24,"component_id":null,"bbox":null,"image_url":null,"path":null,"speed":null,"patrol":null,"strength":null,"opens":null},{"id":"goal","type":"goal","x":45,"y":24,"component_id":null,"bbox":null,"image_url":null,"path":null,"speed":null,"patrol":null,"strength":null,"opens":null},{"id":"c1","type":"coin","x":6,"y":23,"component_id":null,"bbox":null,"image_url":null,"path":null,"speed":null,"patrol":null,"strength":null,"opens":null},{"id":"c2","type":"coin","x":12,"y":22,"component_id":null,"bbox":null,"image_url":null,"path":null,"speed":null,"patrol":null,"strength":null,"opens":null},{"id":"c3","type":"coin","x":20,"y":20,"component_id":null,"bbox":null,"image_url":null,"path":null,"speed":null,"patrol":null,"strength":null,"opens":null},{"id":"c4","type":"coin","x":36,"y":20,"component_id":null,"bbox":null,"image_url":null,"path":null,"speed":null,"patrol":null,"strength":null,"opens":null},{"id":"c5","type":"coin","x":42,"y":23,"component_id":null,"bbox":null,"image_url":null,"path":null,"speed":null,"patrol":null,"strength":null,"opens":null}],"rules":[{"when":"timer:45","then":"lose"}],"meta":{"solvable":true,"warnings":[],"notes_transcript":"timer 45"}}
