{
  "schema_version": 1,
  "id": "lvl_starter3",
  "game_id": "game_starter",
  "parent_id": null,
  "order_index": 2,
  "title": "Key Cave",
  "author": "team",
  "created_at": "2026-10-09T00:00:00Z",
  "source": {
    "kind": "fixture",
    "photo_url": null,
    "backdrop_url": null,
    "template_version": 1
  },
  "grid": {
    "w": 48,
    "h": 27,
    "cell": 16,
    "rows": [
      "111111111111111111111111111111111111111111111111",
      "000000000000000000000000000000000000000010000000",
      "000000000000000000000000000000000000000010000000",
      "000000000000000000000000000000000000000010000000",
      "000000000000000000000000000000000000000010000000",
      "000000000000000000000000000000000000000010000000",
      "000000000000000000000000000000000000000010000000",
      "000000000000000000000000000000000000000010000000",
      "000000000000000000000000000000000000000010000000",
      "000000000000000000000000000000000000000010000000",
      "000000000000000000000000000000000000000010000000",
      "000000000000000000000000000000000000000010000000",
      "000000000000000000000000000000000000000010000000",
      "000000000000000000000000000000000000000010000000",
      "000000000000000000000000000000000000000010000000",
      "000000000000000000000000000000000000000010000000",
      "000000000000000000000000000000000000000010000000",
      "000000000000000000000000000000000000000010000000",
      "000000000000000000000000000000000000000010000000",
      "000000000000000000000000000111000000000010000000",
      "000000000000000000000000000000000000000010000000",
      "000000000000000000000000000000000000000000000000",
      "000000000011111111111111100000000000000000000000",
      "000000000000000000000000000000000000000000000000",
      "000000000000000000000000000000000000000000000000",
      "111111111111111111111111111111110000111111111111",
      "111111111111111111111111111111112222111111111111"
    ]
  },
  "sprites": {
    "player": null
  },
  "components": [],
  "entities": [
    {
      "id": "start",
      "type": "player_start",
      "x": 2,
      "y": 24
    },
    {
      "id": "goal",
      "type": "goal",
      "x": 45,
      "y": 24
    },
    {
      "id": "c1",
      "type": "coin",
      "x": 12,
      "y": 20
    },
    {
      "id": "c2",
      "type": "coin",
      "x": 20,
      "y": 20
    },
    {
      "id": "c3",
      "type": "coin",
      "x": 33,
      "y": 22
    },
    {
      "id": "c4",
      "type": "coin",
      "x": 44,
      "y": 23
    },
    {
      "id": "en1",
      "type": "enemy",
      "component_id": null,
      "bbox": [
        14,
        20,
        15,
        21
      ],
      "image_url": null,
      "patrol": {
        "dx": 6,
        "speed": 3
      }
    },
    {
      "id": "key1",
      "type": "key",
      "x": 28,
      "y": 17,
      "opens": "door1"
    },
    {
      "id": "cp1",
      "type": "checkpoint",
      "x": 30,
      "y": 24
    },
    {
      "id": "door1",
      "type": "door",
      "component_id": null,
      "bbox": [
        40,
        21,
        40,
        24
      ],
      "image_url": null
    }
  ],
  "rules": [
    {
      "when": "collect:key1",
      "then": "open:door1"
    }
  ],
  "meta": {
    "solvable": true,
    "warnings": [],
    "notes_transcript": ""
  }
}
