{
  "schema_version": 1,
  "id": "d_23962d19",
  "game_id": null,
  "parent_id": null,
  "order_index": 0,
  "title": "Synth 1",
  "author": "draft",
  "created_at": "2026-10-10T05:20:18Z",
  "source": {
    "kind": "paper",
    "photo_url": "/uploads/drafts/d_23962d19/photo.jpg",
    "backdrop_url": "/uploads/drafts/d_23962d19/backdrop.png",
    "template_version": 1
  },
  "grid": {
    "w": 48,
    "h": 27,
    "cell": 16,
    "rows": [
      "000000000000000000000000000000000000000000000000",
      "000000000000000000000000000000000000000000000000",
      "000000000000000000000000000000000000000000000000",
      "000000000000000000000000000000000000000000000000",
      "000000000000000000000000000000000000000000000000",
      "000000000000000000000000000000000000000000000000",
      "000000000000000000000000000000000000000000000000",
      "000000000000000000000000000000000000000000000000",
      "000000000000000000000000000000000000000000000000",
      "000000000000000000000000000000000000000000000000",
      "000000000000000000000000000000000000000000000000",
      "000000000000000000000000000000000000000000000000",
      "000000000000000000000000000000000000000000000000",
      "000000000000000000000000000000000000000000000000",
      "000000000000000000000000000000000000000000000000",
      "000000000000000000000000000000000000000000000000",
      "000000000000000000000000000000000000000000000000",
      "000000000000000000000000000000000000000000000000",
      "000000000000000000000000000000000000000000000000",
      "000000000000000000000000000000000000000000000000",
      "000000001111110000000000000000000000000000000000",
      "000000000000000000000000000000000000000000000000",
      "000000000000000000000000000000000000000000000000",
      "000000000000000000000000000000000000000000000000",
      "000000000000000000000000000000222200000000000000",
      "011111111111111111111000001111111111111111111110",
      "000000000000000000000000000000000000000000000000"
    ]
  },
  "sprites": {
    "player": "/uploads/drafts/d_23962d19/player.png"
  },
  "components": [
    {
      "id": 2,
      "color": "blue",
      "bbox": [
        19,
        14,
        19,
        14
      ],
      "area_cells": 1
    },
    {
      "id": 3,
      "color": "black",
      "bbox": [
        16,
        16,
        22,
        16
      ],
      "area_cells": 7
    },
    {
      "id": 5,
      "color": "blue",
      "bbox": [
        10,
        18,
        10,
        18
      ],
      "area_cells": 1
    },
    {
      "id": 6,
      "color": "black",
      "bbox": [
        8,
        20,
        13,
        20
      ],
      "area_cells": 6
    },
    {
      "id": 7,
      "color": "green",
      "bbox": [
        43,
        21,
        45,
        23
      ],
      "area_cells": 5
    },
    {
      "id": 8,
      "color": "blue",
      "bbox": [
        36,
        22,
        36,
        22
      ],
      "area_cells": 1
    },
    {
      "id": 9,
      "color": "red",
      "bbox": [
        30,
        24,
        33,
        24
      ],
      "area_cells": 4
    },
    {
      "id": 10,
      "color": "black",
      "bbox": [
        1,
        25,
        20,
        25
      ],
      "area_cells": 20
    },
    {
      "id": 11,
      "color": "black",
      "bbox": [
        26,
        25,
        46,
        25
      ],
      "area_cells": 21
    }
  ],
  "entities": [
    {
      "id": "e3",
      "type": "moving_platform",
      "x": null,
      "y": null,
      "component_id": 3,
      "bbox": [
        16,
        16,
        22,
        16
      ],
      "image_url": "/uploads/drafts/d_23962d19/comp_3.png",
      "path": [
        [
          16,
          16
        ],
        [
          24,
          16
        ]
      ],
      "speed": 2.0,
      "patrol": null,
      "strength": null,
      "opens": null
    },
    {
      "id": "start",
      "type": "player_start",
      "x": 1,
      "y": 24,
      "component_id": null,
      "bbox": null,
      "image_url": null,
      "path": null,
      "speed": null,
      "patrol": null,
      "strength": null,
      "opens": null
    },
    {
      "id": "goal",
      "type": "goal",
      "x": 44,
      "y": 22,
      "component_id": null,
      "bbox": null,
      "image_url": null,
      "path": null,
      "speed": null,
      "patrol": null,
      "strength": null,
      "opens": null
    },
    {
      "id": "c1",
      "type": "coin",
      "x": 19,
      "y": 14,
      "component_id": null,
      "bbox": null,
      "image_url": null,
      "path": null,
      "speed": null,
      "patrol": null,
      "strength": null,
      "opens": null
    },
    {
      "id": "c2",
      "type": "coin",
      "x": 10,
      "y": 18,
      "component_id": null,
      "bbox": null,
      "image_url": null,
      "path": null,
      "speed": null,
      "patrol": null,
      "strength": null,
      "opens": null
    },
    {
      "id": "c3",
      "type": "coin",
      "x": 36,
      "y": 22,
      "component_id": null,
      "bbox": null,
      "image_url": null,
      "path": null,
      "speed": null,
      "patrol": null,
      "strength": null,
      "opens": null
    }
  ],
  "rules": [
    {
      "when": "timer:60",
      "then": "lose"
    }
  ],
  "meta": {
    "solvable": null,
    "warnings": [],
    "notes_transcript": "Synth 1\nmoves\nthe platform moves. 60 seconds"
  }
}
