{
  "schema_version": 1,
  "id": "d_b14b143e",
  "game_id": "game_starter",
  "parent_id": null,
  "order_index": 0,
  "title": "Untitled level",
  "author": "draft",
  "created_at": "2026-10-10T05:24:19Z",
  "source": {
    "kind": "canvas",
    "photo_url": "/uploads/drafts/d_b14b143e/photo.jpg",
    "backdrop_url": "/uploads/drafts/d_b14b143e/backdrop.png",
    "template_version": 1
  },
  "grid": {
    "w": 48,
    "h": 27,
    "cell": 16,
    "rows": [
      "000000000000000000000000000000000000000000000000",
      "000000000000000000000000000000000000000000000000",
      "000000000000000000000000000000000000000000000000",
      "000000000000000000000000000000000000000000000000",
      "000000000000000000000000000000000000000000000000",
      "000000000000000000000000000000000000000000000000",
      "000000000000000000000000000000000000000000000000",
      "000000000000000000000000000000000000000000000000",
      "000000000000000000000000000000000000000000000000",
      "000000000000000000000000000000000000000000000000",
      "000000000000000000000000000000000000000000000000",
      "000000000000000000000000000000000000000000000000",
      "000000000000000000000000000000000000000000000000",
      "000000000000000000000000000000000000000000000000",
      "000000000000000000000000000000000000000000000000",
      "000000000000000000000000000000000000000000000000",
      "000000000000000000000000000000000000000000000000",
      "000000000000000011111111000000000000000000000000",
      "000000000000000011111111110000000000000000000000",
      "000000000000000000000000000000000000000000000000",
      "000000000000000000000000000000000000000000000000",
      "000000000000000000000000000000000000000000000000",
      "000000000022220000000000000000000000000000000000",
      "000000000022220000000000000001111111111111111111",
      "000000000000000000000000000001111111111111100000",
      "000000000000000000000000222220000000000000000000",
      "000000000000000000000000000000000000000000000000"
    ]
  },
  "sprites": {
    "player": "/uploads/drafts/d_b14b143e/player.png"
  },
  "components": [
    {
      "id": 1,
      "color": "black",
      "bbox": [
        33,
        13,
        40,
        14
      ],
      "area_cells": 9
    },
    {
      "id": 2,
      "color": "black",
      "bbox": [
        16,
        17,
        25,
        18
      ],
      "area_cells": 18
    },
    {
      "id": 3,
      "color": "green",
      "bbox": [
        45,
        20,
        46,
        23
      ],
      "area_cells": 6
    },
    {
      "id": 4,
      "color": "red",
      "bbox": [
        10,
        22,
        13,
        23
      ],
      "area_cells": 8
    },
    {
      "id": 5,
      "color": "black",
      "bbox": [
        0,
        23,
        23,
        24
      ],
      "area_cells": 46
    },
    {
      "id": 6,
      "color": "black",
      "bbox": [
        29,
        23,
        47,
        24
      ],
      "area_cells": 33
    },
    {
      "id": 7,
      "color": "red",
      "bbox": [
        24,
        25,
        28,
        25
      ],
      "area_cells": 5
    }
  ],
  "entities": [
    {
      "id": "e1",
      "type": "moving_platform",
      "x": null,
      "y": null,
      "component_id": 1,
      "bbox": [
        33,
        13,
        40,
        14
      ],
      "image_url": "/uploads/drafts/d_b14b143e/comp_1.png",
      "path": [
        [
          33,
          13
        ],
        [
          40,
          13
        ]
      ],
      "speed": 2.0,
      "patrol": null,
      "strength": null,
      "opens": null
    },
    {
      "id": "e5",
      "type": "moving_platform",
      "x": null,
      "y": null,
      "component_id": 5,
      "bbox": [
        0,
        23,
        23,
        24
      ],
      "image_url": "/uploads/drafts/d_b14b143e/comp_5.png",
      "path": [
        [
          0,
          23
        ],
        [
          0,
          23
        ]
      ],
      "speed": 2.0,
      "patrol": null,
      "strength": null,
      "opens": null
    },
    {
      "id": "start",
      "type": "player_start",
      "x": 0,
      "y": 22,
      "component_id": null,
      "bbox": null,
      "image_url": null,
      "path": null,
      "speed": null,
      "patrol": null,
      "strength": null,
      "opens": null
    },
    {
      "id": "goal",
      "type": "goal",
      "x": 45,
      "y": 21,
      "component_id": null,
      "bbox": null,
      "image_url": null,
      "path": null,
      "speed": null,
      "patrol": null,
      "strength": null,
      "opens": null
    }
  ],
  "rules": [
    {
      "when": "timer:45",
      "then": "lose"
    }
  ],
  "meta": {
    "solvable": null,
    "warnings": [
      "moving platform 5 has no room to move"
    ],
    "notes_transcript": "the high platform moves left and right 4 cells; timer 45"
  }
}
