{
  "schema_version": 1,
  "id": "lvl_starter2",
  "game_id": "game_starter",
  "parent_id": null,
  "order_index": 1,
  "title": "Spike Valley",
  "author": "team",
  "created_at": "2026-10-09T00:00:00Z",
  "source": {
    "kind": "fixture",
    "photo_url": null,
    "backdrop_url": null,
    "template_version": 1
  },
  "grid": {
    "w": 48,
    "h": 27,
    "cell": 16,
    "rows": [
      "000000000000000000000000000000000000000000000000",
      "000000000000000000000000000000000000000000000000",
      "000000000000000000000000000000000000000000000000",
      "000000000000000000000000000000000000000000000000",
      "000000000000000000000000000000000000000000000000",
      "000000000000000000000000000000000000000000000000",
      "000000000000000000000000000000000000000000000000",
      "000000000000000000000000000000000000000000000000",
      "000000000000000000000000000000000000000000000000",
      "000000000000000000000000000000000000000000000000",
      "000000000000000000000000000000000000000000000000",
      "000000000000000000000000000000000000000000000000",
      "000000000000000000000000000000000000000000000000",
      "000000000000000000000000000000000000000000000000",
      "000000000000000000000000000000000000000000000000",
      "000000000000000000000000000000000000000000000000",
      "000000000000000000000000000000000000000000000000",
      "000000000000000000000000000000000000000000000000",
      "000000000000000000000000000000000000000000000000",
      "000000000000000000000000000000000000000000011111",
      "000000000000000000000000000000000000000000000000",
      "000000000000000000000000000000000000000000000000",
      "000000000000000000000000000000000000000000000000",
      "000000000000000000000000000000000000000000000000",
      "000000000000000000000000000000000000000011000000",
      "111111111100001111111100000111100000001111111111",
      "111111111122221111111122222111122222221111111111"
    ]
  },
  "sprites": {
    "player": null
  },
  "components": [],
  "entities": [
    {
      "id": "start",
      "type": "player_start",
      "x": 2,
      "y": 24
    },
    {
      "id": "goal",
      "type": "goal",
      "x": 46,
      "y": 18
    },
    {
      "id": "c1",
      "type": "coin",
      "x": 6,
      "y": 23
    },
    {
      "id": "c2",
      "type": "coin",
      "x": 12,
      "y": 22
    },
    {
      "id": "c3",
      "type": "coin",
      "x": 24,
      "y": 22
    },
    {
      "id": "c4",
      "type": "coin",
      "x": 34,
      "y": 23
    },
    {
      "id": "c5",
      "type": "coin",
      "x": 45,
      "y": 17
    },
    {
      "id": "mp1",
      "type": "moving_platform",
      "component_id": null,
      "bbox": [
        31,
        25,
        33,
        25
      ],
      "image_url": null,
      "path": [
        [
          31,
          25
        ],
        [
          35,
          25
        ]
      ],
      "speed": 2
    },
    {
      "id": "bp1",
      "type": "bounce_pad",
      "component_id": null,
      "bbox": [
        40,
        24,
        41,
        24
      ],
      "strength": 1.0
    }
  ],
  "rules": [],
  "meta": {
    "solvable": true,
    "warnings": [],
    "notes_transcript": ""
  }
}
